,Panel,Product,Likes,Likes_new,Sentiment,Dislikes,Dislikes_new,SentimentDislike
568,Marlts,G647,It is not good and hurts in the throat. There is no flavor also.,"['not', 'good', 'hurt', 'throat', 'no', 'flavor', 'also']",0.942124,Flavor should be added in it/ No.,"['flavor', 'should', 'add', 'no']",0.07405229
569,MGA,V476,Taste is very strong. It should be changed.,"['taste', 'very', 'strong', 'should', 'change']",0.014458251,Taste is not good/ It is strong. It should be made light.,"['taste', 'not', 'good', 'strong', 'should', 'make', 'light']",0.013346135
570,MGA,T295,This is a very soft strong/ So it should be made strong. You can't enjoy smoking if it is a light cigarette.,"['very', 'soft', 'strong', 'should', 'make', 'strong', 'cannot', 'enjoy', 'smoking', 'light', 'cigarette']",0.0027971403,"They should add menthol to this cigarette/ I mean mint flavor/ if mint is added to it, you will enjoy smoking it.","['should', 'add', 'menthol', 'cigarette', 'mean', 'mint', 'flavor', 'mint', 'add', 'enjoy', 'smoking']",0.0014812815
571,Marlts,T295,After taste remains for long time and it doesn’t hurt in the throat.,"['after', 'taste', 'remains', 'long', 'time', 'not', 'hurt', 'throat']",0.68622947,No response,"['no', 'response']",0.98012805
572,Marlts,T295,Taste and flavor is good.,"['taste', 'flavor', 'good']",0.92603993,No.,['no'],0.9409806
573,Marlts,B845,This is a hard cigarette. Those who like hard cigarettes will prefer this. ,"['hard', 'cigarette', 'like', 'hard', 'cigarette', 'prefer']",0.018036535,cigarette is light. It should be strong.,"['cigarette', 'light', 'should', 'strong']",0.02084145
574,Marlts,K817,It is smooth and has good flavor.,"['smooth', 'good', 'flavor']",0.97929776,Nothing.,['nothing'],0.9433711
575,Marlts,K817,This is a good blend and is very smooth. Taste is also good.,"['good', 'blend', 'very', 'smooth', 'taste', 'also', 'good']",0.9952361,It would taste better if some flavor is added to it.,"['would', 'taste', 'well', 'flavor', 'add']",0.3172585
576,Marlts,D782,It tastes good and smooth to smoke/ No. everything else is good.,"['taste', 'good', 'smooth', 'smoke', 'no', 'everything', 'else', 'good']",0.9986517,Everything is good but cigarette is slightly hard. So that should be changed.,"['everything', 'good', 'but', 'cigarette', 'slightly', 'hard', 'should', 'change']",0.0048683346
577,MGA,B845,Will say that this is a smooth cigarette. It is hard also. So this cigarette is good for those who smoke hard cigarette.,"['say', 'smooth', 'cigarette', 'hard', 'also', 'cigarette', 'good', 'smoke', 'hard', 'cigarette']",0.45582116,Everything is good.,"['everything', 'good']",0.973551
578,MGA,D782,cigarette doesn’t have any taste/ And is a very light cigarette.,"['cigarette', 'not', 'taste', 'very', 'light', 'cigarette']",0.41297072,Tobacco content should be reduced. It makes the blend very strong.,"['tobacco', 'content', 'should', 'reduce', 'make', 'blend', 'very', 'strong']",0.0015045626
579,MGA,G647,This is a light cigarette and good. It is smooth and not hard. ,"['light', 'cigarette', 'good', 'smooth', 'not', 'hard']",0.7759619,No need to make any changes. It is good.,"['no', 'need', 'make', 'change', 'good']",0.9868096
580,MGA,D782,Taste is superb. It is an super cigarette.,"['taste', 'superb', 'super', 'cigarette']",0.9939744,No.,['no'],0.9409806
581,MGA,B845,Will not say anything.,"['not', 'say', 'anything']",0.625112,Blank,['blank'],0.78981745
582,MGA,K817,That this is a light cigarette.,"['light', 'cigarette']",0.64345133,Will make the cigarette a light one/ No.,"['make', 'cigarette', 'light', 'one', 'no']",0.9162592
583,Marlts,G647,cigarette is smooth and good. It doesn’t hurt in the throat. I will ask my friends to smoke in large quantity.,"['cigarette', 'smooth', 'good', 'not', 'hurt', 'throat', 'ask', 'friend', 'smoke', 'large', 'quantity']",0.9402001,Will not make any changes. cigarette is good with awesome taste. Smell is also good.,"['not', 'make', 'change', 'cigarette', 'good', 'awesome', 'taste', 'smell', 'also', 'good']",0.86239487
584,MGA,V476,That blend is smooth and easy to smoke. Main thing is it is not difficult to take the smoke. It goes easily.,"['blend', 'smooth', 'easy', 'smoke', 'main', 'thing', 'not', 'difficult', 'take', 'smoke', 'go', 'easily']",0.49533758,There is no need to make any changes and it is a perfect blend. I had never seen such blend. It should come in market.,"['no', 'need', 'make', 'change', 'perfect', 'blend', 'never', 'see', 'blend', 'should', 'come', 'market']",0.9508968
585,MGA,T295,I liked this blend very much and it should be launched in market. I will refer to my friends also.,"['like', 'blend', 'very', 'much', 'should', 'launch', 'market', 'refer', 'friend', 'also']",0.37523,Will not make any changes. I would say that this is a very good cigarette.,"['not', 'make', 'change', 'would', 'say', 'very', 'good', 'cigarette']",0.923362
586,MGA,T295,Will say that it is a smooth cigarette and doesn’t hurt in the throat. ,"['say', 'smooth', 'cigarette', 'not', 'hurt', 'throat']",0.9282326,No need to make any changes. It is good.,"['no', 'need', 'make', 'change', 'good']",0.9868096
587,Marlts,V476,I liked this blend and will ask my friends to smoke this one. ,"['like', 'blend', 'ask', 'friend', 'smoke', 'one']",0.9854857,Will not make any changes. Its taste is good.,"['not', 'make', 'change', 'taste', 'good']",0.8750697
588,Marlts,B845,This is a good cigarette and will ask them to try it/ That’s it.,"['good', 'cigarette', 'ask', 'try']",0.9921864,No need to make any changes. It is good.,"['no', 'need', 'make', 'change', 'good']",0.9868096
589,Marlts,D782,I liked your blend very much. Tobacco is very smooth and doesn’t hurt in the throat. I will recommend to my friends also.,"['like', 'blend', 'very', 'much', 'tobacco', 'very', 'smooth', 'not', 'hurt', 'throat', 'recommend', 'friend', 'also']",0.52194875,I will not make any changes. It is good.,"['not', 'make', 'change', 'good']",0.86170936
590,Marlts,K817,Product is good and it refreshes your mind. It doesn’t your throat.,"['product', 'good', 'refreshes', 'mind', 'not', 'throat']",0.607048,Will increase the tobacco quantity in the cigarette.,"['increase', 'tobacco', 'quantity', 'cigarette']",0.07577781
591,Marlts,G647,Will say that this is a good cigarette and doesn’t hurt your throat on inhaling the smoke. Will ask them to smoke also.,"['say', 'good', 'cigarette', 'not', 'hurt', 'throat', 'inhale', 'smoke', 'ask', 'smoke', 'also']",0.8757238,No because it is good and smooth to smoke. I liked it.,"['no', 'good', 'smooth', 'smoke', 'like']",0.99509877
592,MGA,K817,That cigarette taste is good and doesn’t hurt you in anyways.,"['cigarette', 'taste', 'good', 'not', 'hurt', 'anyways']",0.98254895,Will not make any changes.,"['not', 'make', 'change']",0.44721955
593,MGA,B845,cigarette is very smooth. It was not harsh while going inside. ,"['cigarette', 'very', 'smooth', 'not', 'harsh', 'go', 'inside']",0.0615974,There is nothing to change in the blend.,"['nothing', 'change', 'blend']",0.9874194
594,MGA,D782,That this cigarettes tastes good while smoking and it doesn’t irritates in the throat. So will ask my friends to smoke it.,"['cigarette', 'taste', 'good', 'smoking', 'not', 'irritates', 'throat', 'ask', 'friend', 'smoke']",0.045355164,Will not make any changes. It is smooth to smoke and tastes good. ,"['not', 'make', 'change', 'smooth', 'smoke', 'taste', 'good']",0.98145664
595,Marlts,B845,cigarette is good but they should improve the quality of tobacco and add some taste to it.,"['cigarette', 'good', 'but', 'should', 'improve', 'quality', 'tobacco', 'add', 'taste']",0.039632007,Only the tobacco quality should be improved. Everything else is good.,"['tobacco', 'quality', 'should', 'improve', 'everything', 'else', 'good']",0.64345944
596,MGA,D782,This cigarette is hard while smoking and tobacco flavor is also not good/ No.,"['cigarette', 'hard', 'smoking', 'tobacco', 'flavor', 'also', 'not', 'good', 'no']",0.31981388,It would be good tobacco flavor is changed and filter size is increased.,"['would', 'good', 'tobacco', 'flavor', 'change', 'filter', 'size', 'increase']",0.028801307
597,MGA,K817,I liked this new blend and is very smooth to smoke. I will continue smoking this blend only.,"['like', 'new', 'blend', 'very', 'smooth', 'smoke', 'continue', 'smoking', 'blend']",0.98954904,No. it should be same.,"['no', 'should']",0.70833004
598,MGA,K817,This product is very good. I will suggest everyone to leave your blend and smoke this blend. ,"['product', 'very', 'good', 'suggest', 'everyone', 'leave', 'blend', 'smoke', 'blend']",0.9956976,No need to make any changes. It is good.,"['no', 'need', 'make', 'change', 'good']",0.9868096
599,MGA,B845,This blend was good and smooth compared to the first one. ,"['blend', 'good', 'smooth', 'compare', 'first', 'one']",0.992421,"I will not make any changes. The smoothness, taste and flavor should be same.","['not', 'make', 'change', 'smoothness', 'taste', 'flavor', 'should']",0.16009657
600,MGA,D782,This is a good cigarette and is very light. ,"['good', 'cigarette', 'very', 'light']",0.9384866,I will make it smooth. ,"['make', 'smooth']",0.85017294
601,MGA,G647,Will say that this is a good cigarette and doesn’t hurt your throat on inhaling the smoke. Will ask them to smoke also.,"['say', 'good', 'cigarette', 'not', 'hurt', 'throat', 'inhale', 'smoke', 'ask', 'smoke', 'also']",0.8757238,there is no need to make any changes because it doesn’t hurt in the throat unlike other cigarettes.,"['no', 'need', 'make', 'change', 'not', 'hurt', 'throat', 'unlike', 'cigarette']",0.7567363
602,MGA,V476,That this is a good cigarette and doesn’t  bitter after smoking.,"['good', 'cigarette', 'not', 'bitter', 'after', 'smoking']",0.38772038,I will not make any changes because it is  a good blend.,"['not', 'make', 'change', 'good', 'blend']",0.97531915
603,MGA,B845,That this is a good cigarette and doesn’t hurt in the throat. Will ask them to try it once.,"['good', 'cigarette', 'not', 'hurt', 'throat', 'ask', 'try']",0.96872,I will not make any changes.,"['not', 'make', 'change']",0.44721955
604,MGA,V476,That this is a smooth cigarette and different from other cigarettes. I will ask them to smoke this cigarette only. ,"['smooth', 'cigarette', 'different', 'cigarette', 'ask', 'smoke', 'cigarette']",0.98652923,Will not make any changes. It is slightly strong. It should be more light.,"['not', 'make', 'change', 'slightly', 'strong', 'should', 'light']",0.0017087472
605,Marlts,D782,That the cigarette is good and there are no issues in smoking it.,"['cigarette', 'good', 'no', 'issue', 'smoking']",0.9860525,There is no need to make  any changes. Smoke and taste everything is perfect.,"['no', 'need', 'make', 'change', 'smoke', 'taste', 'everything', 'perfect']",0.9911726
606,Marlts,T295,Will say that this is a good cigarette and new in market. Will ask them to try it once. Its quality is also good.,"['say', 'good', 'cigarette', 'new', 'market', 'ask', 'try', 'quality', 'also', 'good']",0.99872345,No need to make any changes. It is good.,"['no', 'need', 'make', 'change', 'good']",0.9868096
607,MGA,T295,cigarette's taste is good.,"['cigarette', 'taste', 'good']",0.962008,Product is good. No need to make any changes.,"['product', 'good', 'no', 'need', 'make', 'change']",0.97806865
608,Marlts,V476,Will say that this is a good blend.,"['say', 'good', 'blend']",0.99430215,No need to make any changes. It is good.,"['no', 'need', 'make', 'change', 'good']",0.9868096
609,MGA,G647,Will suggest them to smoke this blend as it is very smooth/ No.,"['suggest', 'smoke', 'blend', 'very', 'smooth', 'no']",0.9957561,No need to make any changes. It is good.,"['no', 'need', 'make', 'change', 'good']",0.9868096
610,Marlts,V476,That this is a very good cigarette and I enjoyed smoking it.,"['very', 'good', 'cigarette', 'enjoy', 'smoking']",0.88163954,No.,['no'],0.9409806
611,Marlts,K817,That this is a very good cigarette with good taste and it tastes like my product only.,"['very', 'good', 'cigarette', 'good', 'taste', 'taste', 'like', 'product']",0.9289961,No.,['no'],0.9409806
612,Marlts,D782,Blank,['blank'],0.78981745,No.,['no'],0.9409806
613,Marlts,G647,This is a hard cigarette/ It is hard to take puff. It is OK but I didn’t like it.,"['hard', 'cigarette', 'hard', 'take', 'puff', 'ok', 'but', 'not', 'like']",0.0032578893,Yes/ Everything is good but cigarette is very hard. It should be light.,"['yes', 'everything', 'good', 'but', 'cigarette', 'very', 'hard', 'should', 'light']",0.021291884
614,Marlts,V476,Filter is very big and cigarette is very smooth. ,"['filter', 'very', 'big', 'cigarette', 'very', 'smooth']",0.7460168,cigarette is very smooth. You have to put pressure while taking the puff. ,"['cigarette', 'very', 'smooth', 'put', 'pressure', 'take', 'puff']",0.8815984
615,Marlts,B845,This is a good blend and is light and smooth.,"['good', 'blend', 'light', 'smooth']",0.99265987,No/ Yes. Everything is good.,"['no', 'yes', 'everything', 'good']",0.9969099
616,MGA,V476,cigarette was smooth and filter is also good.,"['cigarette', 'smooth', 'filter', 'also', 'good']",0.9766749,No.,['no'],0.9409806
617,Marlts,D782,cigarette is good and has good taste.,"['cigarette', 'good', 'good', 'taste']",0.99442875,No. it is good.,"['no', 'good']",0.99228376
618,MGA,G647,Will say that the cigarette flavor is good. Even the smoke and taste is good.,"['say', 'cigarette', 'flavor', 'good', 'even', 'smoke', 'taste', 'good']",0.9974572,Hardness of the cigarette should be increased.,"['hardness', 'cigarette', 'should', 'increase']",0.011613465
619,Marlts,V476,It is good. ,['good'],0.95813644,cigarette should be light because it is very hard.,"['cigarette', 'should', 'light', 'very', 'hard']",0.010642766
620,Marlts,T295,Will ask them to smoke and see/ I think the the filter doesn’t filter the smoke ,"['ask', 'smoke', 'see', 'think', 'filter', 'not', 'filter', 'smoke']",0.66530585,Filter should be changed. Eyes burn because of the smoke. So that should not be there and should not hurt in the throat.,"['filter', 'should', 'change', 'eye', 'burn', 'smoke', 'should', 'not', 'should', 'not', 'hurt', 'throat']",0.00060259126
621,MGA,B845,Will ask them to smoke this blend only. It is smooth and good.,"['ask', 'smoke', 'blend', 'smooth', 'good']",0.9974368,No.,['no'],0.9409806
622,Marlts,G647,It is a good cigarette. You feel good in the throat on smoking it.,"['good', 'cigarette', 'feel', 'good', 'throat', 'smoking']",0.9148774,will not change anything. cigarette is good.,"['not', 'change', 'anything', 'cigarette', 'good']",0.8160616
623,MGA,K817,Because cigarette is smooth and doesn’t hurt in the throat.,"['cigarette', 'smooth', 'not', 'hurt', 'throat']",0.88210255,No.,['no'],0.9409806
624,Marlts,T295,That the cigarette is good and soft to smoke. ,"['cigarette', 'good', 'soft', 'smoke']",0.99089885,Will stop smoking our regular blend and start smoking this blend/ No. this is good. ,"['stop', 'smoking', 'regular', 'blend', 'start', 'smoking', 'blend', 'no', 'good']",0.99819
625,Marlts,D782,Everyone should prefer this cigarette. It has less tobacco content and is a light cigarette. Even smoke is less/ No.,"['everyone', 'should', 'prefer', 'cigarette', 'less', 'tobacco', 'content', 'light', 'cigarette', 'even', 'smoke', 'less', 'no']",0.002046978,It is good but tobacco content should be increased/ No.,"['good', 'but', 'tobacco', 'content', 'should', 'increase', 'no']",0.01158507
626,Marlts,B845,cigarette is very strong. It should be slightly light and should be easy to smoke. But this cigarette is very hard.,"['cigarette', 'very', 'strong', 'should', 'slightly', 'light', 'should', 'easy', 'smoke', 'but', 'cigarette', 'very', 'hard']",0.0004564721,Taste should be changed and strongness should be reduced. It hurts in the throat.,"['taste', 'should', 'change', 'strongness', 'should', 'reduce', 'hurt', 'throat']",0.00067369884
627,MGA,D782,This is a good blend but taste is not good. The first one has better than this blend/ No.,"['good', 'blend', 'but', 'taste', 'not', 'good', 'first', 'one', 'well', 'blend', 'no']",0.99337244,Will change the flavor and filter.,"['change', 'flavor', 'filter']",0.71421957
628,Marlts,G647,This is a mild cigarette and is very smooth. It is good for those who prefer smoking mild cigarettes.,"['mild', 'cigarette', 'very', 'smooth', 'good', 'prefer', 'smoking', 'mild', 'cigarette']",0.1204124,cigarette should be made strong and tobacco content should be increased.,"['cigarette', 'should', 'make', 'strong', 'tobacco', 'content', 'should', 'increase']",0.00032407694
629,MGA,B845,cigarette is good and is very smooth. It doesn’t hurt in the throat also.,"['cigarette', 'good', 'very', 'smooth', 'not', 'hurt', 'throat', 'also']",0.8729197,Blank,['blank'],0.78981745
630,Marlts,B845,cigarette is smooth and has good taste but it hurts in the throat.,"['cigarette', 'smooth', 'good', 'taste', 'but', 'hurt', 'throat']",0.9541159,cigarette is smooth. So it should be made hard.,"['cigarette', 'smooth', 'should', 'make', 'hard']",0.036850456
631,MGA,V476,This is a new blend and will ask them to try this blend once.,"['new', 'blend', 'ask', 'try', 'blend']",0.99870455,Menthol flavor should be added or cigarette should be made mild. ,"['menthol', 'flavor', 'should', 'add', 'cigarette', 'should', 'make', 'mild']",0.00034754502
632,MGA,G647,This is a very good cigarette and I liked it very much. ,"['very', 'good', 'cigarette', 'like', 'very', 'much']",0.8208303,There is no need to make any changes. It is good.,"['no', 'need', 'make', 'change', 'good']",0.9868096
633,MGA,B845,cigarette is good and doesn’t hurt in the throat.,"['cigarette', 'good', 'not', 'hurt', 'throat']",0.9417971,No.,['no'],0.9409806
634,Marlts,D782,It is also a good blend/ Yes. Taste is good.,"['also', 'good', 'blend', 'yes', 'taste', 'good']",0.9976392,Will share with all my friends/ No. no need to make any changes. It is good.,"['share', 'friend', 'no', 'no', 'need', 'make', 'change', 'good']",0.9980433
635,MGA,V476,It is not that good. I can prefer it when my blend is not available.,"['not', 'good', 'prefer', 'blend', 'not', 'available']",0.97077227,No need to make any changes. It is good.,"['no', 'need', 'make', 'change', 'good']",0.9868096
636,MGA,K817,This is a very good blend. It is smooth and light.,"['very', 'good', 'blend', 'smooth', 'light']",0.9924993,No need to make any changes. It is good.,"['no', 'need', 'make', 'change', 'good']",0.9868096
637,Marlts,T295,cigarette is easy to smoke and I liked it. It is similar to my regular blend.,"['cigarette', 'easy', 'smoke', 'like', 'similar', 'regular', 'blend']",0.9437272,cigarette is good. No need to make any changes.,"['cigarette', 'good', 'no', 'need', 'make', 'change']",0.98539436
638,Marlts,K817,It is easy to smoke and can easily take the puff.,"['easy', 'smoke', 'easily', 'take', 'puff']",0.9200214,It is easy to smoke.,"['easy', 'smoke']",0.9577497
639,MGA,B845,This is a good cblend and not harmful for health.,"['good', 'blend', 'not', 'harmful', 'health']",0.993874,No. ,['no'],0.9409806
640,MGA,D782,That this is a smooth cigarette.,"['smooth', 'cigarette']",0.9085621,No need to make any changes. It is good.,"['no', 'need', 'make', 'change', 'good']",0.9868096
641,Marlts,B845,Inaudible,['inaudible'],0.3233734,cigarette  is strong. It should be smooth.,"['cigarette', 'strong', 'should', 'smooth']",0.044309393
642,MGA,G647,Will say that this is a good cigarette and enjoy smoking it.,"['say', 'good', 'cigarette', 'enjoy', 'smoking']",0.94788665,No need to make any changes. It is good.,"['no', 'need', 'make', 'change', 'good']",0.9868096
643,Marlts,K817,That this is a good blend and better than other cigarettes. Will ask my friends to smoke this blend.,"['good', 'blend', 'well', 'cigarette', 'ask', 'friend', 'smoke', 'blend']",0.9983297,Tobacco quantity and taste everything is perfect. It doesn’t hurt in the throat also. So no need to make any changes.,"['tobacco', 'quantity', 'taste', 'everything', 'perfect', 'not', 'hurt', 'throat', 'also', 'no', 'need', 'make', 'change']",0.887194
644,MGA,D782,Will say that this is a good product and will ask them to try it.,"['say', 'good', 'product', 'ask', 'try']",0.99322236,Tobacco level should be reduced. Everything else is good.,"['tobacco', 'level', 'should', 'reduce', 'everything', 'else', 'good']",0.029458774
645,MGA,K817,Will not tell about this blend because the previous blend was good and perfect level of tobacco.,"['not', 'tell', 'blend', 'previous', 'blend', 'good', 'perfect', 'level', 'tobacco']",0.9984463,No. cigarette is good and smooth. ,"['no', 'cigarette', 'good', 'smooth']",0.9969817
646,MGA,V476,I felt good after smoking. Its is good.,"['felt', 'good', 'after', 'smoking', 'good']",0.98422503,No need to make any changes. It is good.,"['no', 'need', 'make', 'change', 'good']",0.9868096
647,MGA,B845,I will recommend this product to my friends. but the smoke goes very slowly through the throat.,"['recommend', 'product', 'friend', 'but', 'smoke', 'go', 'very', 'slowly', 'throat']",0.534213,Flavor should be changed. ,"['flavor', 'should', 'change']",0.07821949
648,Marlts,K817,This cigarette is very different from my regular blend. This is very light and doesn’t hurt in the throat. ,"['cigarette', 'very', 'different', 'regular', 'blend', 'very', 'light', 'not', 'hurt', 'throat']",0.7651418,No.,['no'],0.9409806
649,MGA,D782,cigarette is good.,"['cigarette', 'good']",0.9625361,No.,['no'],0.9409806
650,MGA,G647,Will say that this is a good blend and will ask them to try this blend once.,"['say', 'good', 'blend', 'ask', 'try', 'blend']",0.9994031,I liked the cigarette. No need to make any changes. It is good.,"['like', 'cigarette', 'no', 'need', 'make', 'change', 'good']",0.9867443
651,MGA,B845,That this is a good product.,"['good', 'product']",0.95046735,Will make it light and smooth.,"['make', 'light', 'smooth']",0.75032717
652,Marlts,G647,It is not a good product.,"['not', 'good', 'product']",0.8777147,Will add some flavor to this/ Inaudible and background noise.,"['add', 'flavor', 'inaudible', 'background', 'noise']",0.052849025
653,MGA,K817,Will ask my friends to try it once.,"['ask', 'friend', 'try']",0.97593904,Tobacco flavor should be changed.,"['tobacco', 'flavor', 'should', 'change']",0.025715183
654,MGA,K817,"cigarette is light. If it is made strong, it will be successful in market.","['cigarette', 'light', 'make', 'strong', 'successful', 'market']",0.19636834,cigarette should be made strong.,"['cigarette', 'should', 'make', 'strong']",0.018139271
655,MGA,D782,That this is a light cigarette.,"['light', 'cigarette']",0.64345133,No need to make any changes. It is good.,"['no', 'need', 'make', 'change', 'good']",0.9868096
656,Marlts,D782,I liked the product but tobacco content was more which hurts in the throat. But will recommend my friends to try it once.,"['like', 'product', 'but', 'tobacco', 'content', 'hurt', 'throat', 'but', 'recommend', 'friend', 'try']",0.14808638,There is no need to make any changes but tobacco content was more. So it should be reduced.,"['no', 'need', 'make', 'change', 'but', 'tobacco', 'content', 'should', 'reduce']",0.001689146
657,MGA,K817,My friends try new products. So they will try this one as this is a good product/ Flavor was good.,"['friend', 'try', 'new', 'product', 'try', 'one', 'good', 'product', 'flavor', 'good']",0.9960634,Taste should be changed and some flavor should be added to the blend/ Like mint flavor or some other flavor.,"['taste', 'should', 'change', 'flavor', 'should', 'add', 'blend', 'like', 'mint', 'flavor', 'flavor']",0.003412842
658,Marlts,B845,This is a good product.,"['good', 'product']",0.95046735,No need to make any changes. It is good.,"['no', 'need', 'make', 'change', 'good']",0.9868096
659,MGA,D782,That this product is better than the first one. And actually it is a very smooth cigarette. So it goes smoothly through the throat.,"['product', 'well', 'first', 'one', 'actually', 'very', 'smooth', 'cigarette', 'go', 'smoothly', 'throat']",0.8142424,No because I liked it taste. ,"['no', 'like', 'taste']",0.94306356
660,MGA,T295,That this is a very good product.  This cigarette has very good smell and you can smoke it.,"['very', 'good', 'product', 'cigarette', 'very', 'good', 'smell', 'smoke']",0.87433094,No need to make any changes. It is good.,"['no', 'need', 'make', 'change', 'good']",0.9868096
661,MGA,V476,This is a good cigarette. It is a light cigarette with good taste.,"['good', 'cigarette', 'light', 'cigarette', 'good', 'taste']",0.9856523,No need to make any changes. It is good.,"['no', 'need', 'make', 'change', 'good']",0.9868096
662,MGA,G647,This cigarette is light and smooth. Filter is big and is tasteless.,"['cigarette', 'light', 'smooth', 'filter', 'big', 'tasteless']",0.5393286,cigarette should be made light because it hurts in the throat. Smoke is also more and filter is not good.,"['cigarette', 'should', 'make', 'light', 'hurt', 'throat', 'smoke', 'also', 'filter', 'not', 'good']",0.23620532
663,MGA,B845,cigarette is good with good flow. Tobacco level is good. ,"['cigarette', 'good', 'good', 'flow', 'tobacco', 'level', 'good']",0.9956678,Everything in the cigarette is good. So there is no need to make any changes.,"['everything', 'cigarette', 'good', 'no', 'need', 'make', 'change']",0.9857911
664,MGA,D782,This cigarette hurts in the throat.,"['cigarette', 'hurt', 'throat']",0.8685712,The puff should be improved. Company  should improve the smoke or puff. It hurts in the throat.,"['puff', 'should', 'improve', 'company', 'should', 'improve', 'smoke', 'puff', 'hurt', 'throat']",0.0037241247
665,MGA,T295,This is  a good cigarette and  doesn’t hurt in the throat. ,"['good', 'cigarette', 'not', 'hurt', 'throat']",0.92606276,No.,['no'],0.9409806
