,Panel,Product,Likes,Likes_new,Sentiment,Dislikes,Dislikes_new,SentimentDislike
384,MGA,V476,This is not a good cigarette. It hurts in the throat.,"['not', 'good', 'cigarette', 'hurt', 'throat']",0.9445456,Will make the cigarette smooth and light and taste should be good.,"['make', 'cigarette', 'smooth', 'light', 'taste', 'should', 'good']",0.619257
385,MGA,V476,This  cigarette gives good and strong kick. So will ask my friends to try this cigarette because I liked it.,"['cigarette', 'give', 'good', 'strong', 'kick', 'ask', 'friend', 'try', 'cigarette', 'like']",0.949302,There is no need to make any changes because it is a smooth and light cigarette. But it has medium taste.,"['no', 'need', 'make', 'change', 'smooth', 'light', 'cigarette', 'but', 'medium', 'taste']",0.49505776
386,MGA,V476,This is a light cigarette and there is no proper smoke/ it hurts in the throat. So tobacco content should be reduced.,"['light', 'cigarette', 'no', 'proper', 'smoke', 'hurt', 'throat', 'tobacco', 'content', 'should', 'reduce']",0.0016943484,Filter size should be increased and tobacco content should be increased.,"['filter', 'size', 'should', 'increase', 'tobacco', 'content', 'should', 'increase']",0.00020591491
387,MGA,K817,This cigarette is smooth and doesn’t hurt in the throat.,"['cigarette', 'smooth', 'not', 'hurt', 'throat']",0.88210255,No.,['no'],0.9409806
388,MGA,D782,This is a good cigarette.,"['good', 'cigarette']",0.96528995,cigarette should be smooth. It doesn’t hurt in the throat.,"['cigarette', 'should', 'smooth', 'not', 'hurt', 'throat']",0.14348795
389,Marlts,G647,It is a good product and doesn’t hurt in the throat.,"['good', 'product', 'not', 'hurt', 'throat']",0.86952794,No.,['no'],0.9409806
390,Marlts,V476, cigarette filter is very good/ Will ask them to try it once.,"['cigarette', 'filter', 'very', 'good', 'ask', 'try']",0.9905669,Will say that this is a very good cigarette but it should be light. Otherwise everything is good.,"['say', 'very', 'good', 'cigarette', 'but', 'should', 'light', 'otherwise', 'everything', 'good']",0.207046
391,Marlts,K817,This is a smooth and light cigarette. It is good.,"['smooth', 'light', 'cigarette', 'good']",0.9725223,No.,['no'],0.9409806
392,MGA,G647,This is a good blend and has very less smoke/ No.,"['good', 'blend', 'very', 'less', 'smoke', 'no']",0.9162221,Flavor is good but they should come up with some different flavors.,"['flavor', 'good', 'but', 'should', 'come', 'different', 'flavor']",0.035060104
393,MGA,V476,Will say that this is a good product and easy to smoke. Even the company is a good company.,"['say', 'good', 'product', 'easy', 'smoke', 'even', 'company', 'good', 'company']",0.9982992,Company is a good company. So need to make any changes.,"['company', 'good', 'company', 'need', 'make', 'change']",0.91658753
394,Marlts,G647,That this is a good product and will ask them to try it.,"['good', 'product', 'ask', 'try']",0.98758894,No need to make any changes. It is perfect.,"['no', 'need', 'make', 'change', 'perfect']",0.9902604
395,Marlts,T295,This is a very good product and easy to smoke. You can easily and smoothly take the puff and it doesn’t hurt in the throat also.,"['very', 'good', 'product', 'easy', 'smoke', 'easily', 'smoothly', 'take', 'puff', 'not', 'hurt', 'throat', 'also']",0.37338954,This is a good blend. No need to make any changes.,"['good', 'blend', 'no', 'need', 'make', 'change']",0.9935813
396,Marlts,G647,That this is a light cigarette. ,"['light', 'cigarette']",0.64345133,No need to make any changes.,"['no', 'need', 'make', 'change']",0.93748623
397,Marlts,T295,Because this is a very good product/ That’s it.,"['very', 'good', 'product']",0.9457625,No need to make any changes. Everything is good.,"['no', 'need', 'make', 'change', 'everything', 'good']",0.9902574
398,Marlts,V476,Because this is a good product,"['good', 'product']",0.95046735,Tobacco quantity and everything is good. ,"['tobacco', 'quantity', 'everything', 'good']",0.83817834
399,MGA,K817,It is a good cigarette. Tobacco quality is good.,"['good', 'cigarette', 'tobacco', 'quality', 'good']",0.9910416,No.,['no'],0.9409806
400,Marlts,V476,Because the taste is superb. It is a new blend and is very good/ Will say my friends to try this cigarette immediately.,"['taste', 'superb', 'new', 'blend', 'very', 'good', 'say', 'friend', 'try', 'cigarette', 'immediately']",0.99822515,No need to make any changes. It is good.,"['no', 'need', 'make', 'change', 'good']",0.9868096
401,Marlts,G647,"cigarette is good and will ask my friends to try this once. If your blend is not available, than I you can prefer this blend.","['cigarette', 'good', 'ask', 'friend', 'try', 'blend', 'not', 'available', 'prefer', 'blend']",0.9984737,Tobacco quantity should be reduced.,"['tobacco', 'quantity', 'should', 'reduce']",0.0039768703
402,Marlts,B845,I will say that a new blend has come in market. It is a very good cigarette. It doesn’t hurt in the throat. ,"['say', 'new', 'blend', 'come', 'market', 'very', 'good', 'cigarette', 'not', 'hurt', 'throat']",0.8844387,No need to make any changes. It is good.,"['no', 'need', 'make', 'change', 'good']",0.9868096
403,Marlts,D782,That this is a new cigarette in market. Its taste is perfect. Tobacco quality is superb.,"['new', 'cigarette', 'market', 'taste', 'perfect', 'tobacco', 'quality', 'superb']",0.99649495,No need to make any changes. Everything is good.,"['no', 'need', 'make', 'change', 'everything', 'good']",0.9902574
404,MGA,B845,I tried this product and I liked it very much. Tobacco flavor and smoke is good.,"['try', 'product', 'like', 'very', 'much', 'tobacco', 'flavor', 'smoke', 'good']",0.6818985,Tobacoc quantity should be increased and filter should be improved.,"['tobacco', 'quantity', 'should', 'increase', 'filter', 'should', 'improve']",0.0010414023
405,MGA,T295,cigarette is good. There is no problem in smoking it.,"['cigarette', 'good', 'no', 'problem', 'smoking']",0.9868744,They should make it slightly smooth. ,"['should', 'make', 'slightly', 'smooth']",0.018713968
406,Marlts,T295,It is a good cigarette and should be light. ,"['good', 'cigarette', 'should', 'light']",0.39540124,No.,['no'],0.9409806
407,MGA,D782,I liked the blend. It is smooth.,"['like', 'blend', 'smooth']",0.96522194,No. it is good.,"['no', 'good']",0.99228376
408,MGA,V476,This cigarette tastes good. Will ask my friends to smoke this cigarette very much.,"['cigarette', 'taste', 'good', 'ask', 'friend', 'smoke', 'cigarette', 'very', 'much']",0.9579034,No need to make any changes. It is good.,"['no', 'need', 'make', 'change', 'good']",0.9868096
409,MGA,B845,It is a hard cigarette.,"['hard', 'cigarette']",0.2056742,I will make the cigarette mild or light.,"['make', 'cigarette', 'mild', 'light']",0.081417985
410,Marlts,K817,Will tell my friends to try it and see. I liked the cigarette's taste.,"['tell', 'friend', 'try', 'see', 'like', 'cigarette', 'taste']",0.9821776,Tobacco level should be reduced and cigarette should be made smooth.,"['tobacco', 'level', 'should', 'reduce', 'cigarette', 'should', 'make', 'smooth']",0.0013316821
411,MGA,T295,cigarette is good and will ask my friend to prefer this cigarettes.,"['cigarette', 'good', 'ask', 'friend', 'prefer', 'cigarette']",0.9853918,No need to make any changes. cigarette is very good and smooth to smoke. ,"['no', 'need', 'make', 'change', 'cigarette', 'very', 'good', 'smooth', 'smoke']",0.992864
412,MGA,T295,Product is good and will ask my friends to try once.,"['product', 'good', 'ask', 'friend', 'try']",0.9935266,No. everything is good.,"['no', 'everything', 'good']",0.99556714
413,Marlts,B845,This is a good cigarette to smoke. Will tell my friends also to smoke.,"['good', 'cigarette', 'smoke', 'tell', 'friend', 'also', 'smoke']",0.9845388,No need to make any changes. It is good.,"['no', 'need', 'make', 'change', 'good']",0.9868096
414,MGA,B845,Blank,['blank'],0.78981745,No.,['no'],0.9409806
415,Marlts,G647,That this is a good product and will ask them to try it.,"['good', 'product', 'ask', 'try']",0.98758894,There is nothing to change in this but filter size should be big.,"['nothing', 'change', 'but', 'filter', 'size', 'should', 'big']",0.031902205
416,Marlts,D782,Will say that this is a very good product and is very good to smoke also.,"['say', 'very', 'good', 'product', 'very', 'good', 'smoke', 'also']",0.9840846,No. it is a good product.,"['no', 'good', 'product']",0.99177706
417,Marlts,K817,I would like to share with my friends that there is new cigarette launched in the market and they should try it. It is good but not very good.,"['would', 'like', 'share', 'friend', 'new', 'cigarette', 'launch', 'market', 'should', 'try', 'good', 'but', 'not', 'very', 'good']",0.95987076,The filter of this cigarette should be changed and the quantity of tobacco should be reduced.,"['filter', 'cigarette', 'should', 'change', 'quantity', 'tobacco', 'should', 'reduce']",0.00057162484
418,MGA,D782,I like this cigarette. It is a good brand.,"['like', 'cigarette', 'good', 'brand']",0.9804904,No changes required in the blend. ,"['no', 'change', 'require', 'blend']",0.9974178
419,Marlts,B845,This cigarette is okay and it doesn't cause any irritation while smoking.,"['cigarette', 'okay', 'not', 'irritation', 'smoking']",0.4476046,I would like to increase the mint flavor for better experience of this cigarette.,"['would', 'like', 'increase', 'mint', 'flavor', 'well', 'experience', 'cigarette']",0.14072788
420,Marlts,B845,This cigarette is little bit hard. The hardness should be reduced so that I can share it with my friends.,"['cigarette', 'little', 'bit', 'hard', 'hardness', 'should', 'reduce', 'share', 'friend']",0.0016902309,The hardness of this cigarette should be reduced. ,"['hardness', 'cigarette', 'should', 'reduce']",0.0057222946
421,Marlts,V476,This cigarette is not very good and the taste is also different. I will suggest my friends not to use it.,"['cigarette', 'not', 'very', 'good', 'taste', 'also', 'different', 'suggest', 'friend', 'not', 'use']",0.91946244,I would like to change the tobacco and the filter of this cigarette. ,"['would', 'like', 'change', 'tobacco', 'filter', 'cigarette']",0.11467057
422,Marlts,G647,This cigarette is a bit light in taste.,"['cigarette', 'bit', 'light', 'taste']",0.20691536,No changes required in the blend. ,"['no', 'change', 'require', 'blend']",0.9974178
423,Marlts,K817,This cigarette is little bit hard but it is good.,"['cigarette', 'little', 'bit', 'hard', 'but', 'good']",0.031201167,I would like to add mint switch for better experience of this cigarette.,"['would', 'like', 'add', 'mint', 'switch', 'well', 'experience', 'cigarette']",0.16269085
424,MGA,D782,It is a very good cigarette. It is similar to the previous one.,"['very', 'good', 'cigarette', 'similar', 'previous', 'one']",0.9501674,I would like to change the filter because it was difficult to take puffs.,"['would', 'like', 'change', 'filter', 'difficult', 'take', 'puff']",0.02121003
425,Marlts,K817,It is a good cigarette and I will recommend it to my friends.,"['good', 'cigarette', 'recommend', 'friend']",0.98084,I would like to change the color of the stick. ,"['would', 'like', 'change', 'color', 'stick']",0.23801845
426,Marlts,G647,This cigarette is little bit harder than the previous one. I will tell my friends to try it if they are interested in hard cigarette.,"['cigarette', 'little', 'bit', 'harder', 'previous', 'one', 'tell', 'friend', 'try', 'interested', 'hard', 'cigarette']",0.0883172,The hardness of this cigarette should be reduced for better experience. ,"['hardness', 'cigarette', 'should', 'reduce', 'well', 'experience']",0.0073885573
427,MGA,V476,It is a good product. It is smooth and nice to smoke.,"['good', 'product', 'smooth', 'nice', 'smoke']",0.9959549,The quantity of tobacco should be increased so that it would be much better.,"['quantity', 'tobacco', 'should', 'increase', 'would', 'much', 'well']",0.003696116
428,Marlts,T295,It is a good cigarette. It is smooth and nice to smoke.,"['good', 'cigarette', 'smooth', 'nice', 'smoke']",0.99738413,No changes required in the blend. It is good.,"['no', 'change', 'require', 'blend', 'good']",0.99936146
429,Marlts,T295,I would like to share with my friends that it is a good cigarette and they should use it. It is smooth and nice to smoke.,"['would', 'like', 'share', 'friend', 'good', 'cigarette', 'should', 'use', 'smooth', 'nice', 'smoke']",0.9775947,No changes required in the blend. ,"['no', 'change', 'require', 'blend']",0.9974178
430,Marlts,G647,It was nice to smoke this cigarette. I will recommend it to my friends.,"['nice', 'smoke', 'cigarette', 'recommend', 'friend']",0.98411554,No changes required in the blend. Everything is perfect.,"['no', 'change', 'require', 'blend', 'everything', 'perfect']",0.9994753
431,MGA,G647,I didn't enjoy smoking this cigarette.,"['not', 'enjoy', 'smoking', 'cigarette']",0.2594792,The quantity of tobacco should be little bit increased.,"['quantity', 'tobacco', 'should', 'little', 'bit', 'increase']",0.0010365705
432,Marlts,B845,I would like to share with my friends that this product is smooth and I enjoyed smoking it. I will suggest them to try it.,"['would', 'like', 'share', 'friend', 'product', 'smooth', 'enjoy', 'smoking', 'suggest', 'try']",0.98277444,The quantity of tobacco should be little bit reduced.,"['quantity', 'tobacco', 'should', 'little', 'bit', 'reduce']",0.0005853505
433,Marlts,D782,The taste of this cigarette is good and I will share the same with my friends.,"['taste', 'cigarette', 'good', 'share', 'friend']",0.99669313,No changes required in the blend. ,"['no', 'change', 'require', 'blend']",0.9974178
434,Marlts,V476,I would like to share with my friends that it is a very good product and they should try it once.,"['would', 'like', 'share', 'friend', 'very', 'good', 'product', 'should', 'try']",0.94969153,No changes required in the blend. Everything is okay.,"['no', 'change', 'require', 'blend', 'everything', 'okay']",0.9984413
435,Marlts,T295,I would like to share with my friends that it is a new product in the market. It is a good product and it has thick filter.,"['would', 'like', 'share', 'friend', 'new', 'product', 'market', 'good', 'product', 'thick', 'filter']",0.9916545,No changes required in the blend. It was not very hard.,"['no', 'change', 'require', 'blend', 'not', 'very', 'hard']",0.9681247
436,MGA,D782,It is a good product.,"['good', 'product']",0.95046735,No changes required in the blend. ,"['no', 'change', 'require', 'blend']",0.9974178
437,MGA,B845,It was nice to smoke this cigarette.,"['nice', 'smoke', 'cigarette']",0.977423,No changes required in the blend. ,"['no', 'change', 'require', 'blend']",0.9974178
438,Marlts,K817,I would like to share with my friends that it is a good product.,"['would', 'like', 'share', 'friend', 'good', 'product']",0.99003536,No changes required in the blend. It is fine.,"['no', 'change', 'require', 'blend', 'fine']",0.99890006
439,Marlts,V476,Inaudible,['inaudible'],0.3233734,I would like to add some flavors and the cigarette should be a bit more smooth.,"['would', 'like', 'add', 'flavor', 'cigarette', 'should', 'bit', 'smooth']",0.0041385544
440,MGA,K817,This product is average and not very good. I will suggest my friends to try it.,"['product', 'average', 'not', 'very', 'good', 'suggest', 'friend', 'try']",0.98056144,This cigarette should be little bit hard.,"['cigarette', 'should', 'little', 'bit', 'hard']",0.0022863245
441,Marlts,B845,It is a good cigarette. It is strong. It is good for those who are used to strong cigarettes.,"['good', 'cigarette', 'strong', 'good', 'use', 'strong', 'cigarette']",0.42184556,This cigarette should be little bit light.,"['cigarette', 'should', 'little', 'bit', 'light']",0.005777712
442,Marlts,G647,The taste of this cigarette is good and it is similar to my regular brand. It doesn't cause any irritation in the throat.,"['taste', 'cigarette', 'good', 'similar', 'regular', 'brand', 'not', 'irritation', 'throat']",0.6822594,No changes required in the blend. ,"['no', 'change', 'require', 'blend']",0.9974178
443,Marlts,B845,This product is very unique. I like the taste so much. The after taste was also very good.,"['product', 'very', 'unique', 'like', 'taste', 'much', 'after', 'taste', 'also', 'very', 'good']",0.5871494,I would like to change the flavor of this cigarette.,"['would', 'like', 'change', 'flavor', 'cigarette']",0.22769727
444,Marlts,G647,This cigarette is little bit harder than my regular brand. I will suggest my friends to try it once.,"['cigarette', 'little', 'bit', 'harder', 'regular', 'brand', 'suggest', 'friend', 'try']",0.25686347,This cigarette should be smooth and the quantity of tobacco should be reduced.,"['cigarette', 'should', 'smooth', 'quantity', 'tobacco', 'should', 'reduce']",0.0010590077
445,Marlts,D782,This cigarette is strong and it is okay for those who are used to strong cigarettes.,"['cigarette', 'strong', 'okay', 'use', 'strong', 'cigarette']",0.05436684,I would like to add mint flavor for better experience of this cigarette.,"['would', 'like', 'add', 'mint', 'flavor', 'well', 'experience', 'cigarette']",0.14968395
446,Marlts,T295,It is a good cigarette but it is little bit strong.,"['good', 'cigarette', 'but', 'little', 'bit', 'strong']",0.049553897,The blend should be little bit light and rest everything is okay.,"['blend', 'should', 'little', 'bit', 'light', 'rest', 'everything', 'okay']",0.019865543
447,Marlts,T295,There is nothing to share about this cigarette.,"['nothing', 'share', 'cigarette']",0.9940795,The blend should be little bit light and smooth.,"['blend', 'should', 'little', 'bit', 'light', 'smooth']",0.030194195
448,Marlts,D782,Inaudible,['inaudible'],0.3233734,No changes required in the blend. ,"['no', 'change', 'require', 'blend']",0.9974178
449,MGA,B845,I would like to share with my friends that it is a good cigarette and they should use it once.,"['would', 'like', 'share', 'friend', 'good', 'cigarette', 'should', 'use']",0.88297707,No changes required in the blend. The flavor was good.,"['no', 'change', 'require', 'blend', 'flavor', 'good']",0.99897015
450,Marlts,K817,The taste of this cigarette is very good and I will recommend it to my friends.,"['taste', 'cigarette', 'very', 'good', 'recommend', 'friend']",0.9786718,No changes required in the blend. ,"['no', 'change', 'require', 'blend']",0.9974178
451,Marlts,B845,It is a good cigarette. The taste is good.,"['good', 'cigarette', 'taste', 'good']",0.9920838,No changes required in the blend. ,"['no', 'change', 'require', 'blend']",0.9974178
452,Marlts,K817,It is a good brand and it was nice to smoke.,"['good', 'brand', 'nice', 'smoke']",0.99816245,No changes required in the blend. ,"['no', 'change', 'require', 'blend']",0.9974178
453,MGA,K817,This cigarette is very soft and it is harmless. It is very nice to smoke.,"['cigarette', 'very', 'soft', 'harmless', 'very', 'nice', 'smoke']",0.9885467,No changes required in the blend. ,"['no', 'change', 'require', 'blend']",0.9974178
454,MGA,T295,It is a very good cigarette. I will suggest my friends to try it.,"['very', 'good', 'cigarette', 'suggest', 'friend', 'try']",0.9943348,No changes required in the blend. It is very good.,"['no', 'change', 'require', 'blend', 'very', 'good']",0.9992163
455,MGA,D782,It is a good cigarette and the taste is also good.,"['good', 'cigarette', 'taste', 'also', 'good']",0.9861491,No changes required in the blend. ,"['no', 'change', 'require', 'blend']",0.9974178
456,Marlts,B845,I like this cigarette and I will recommend it to my friends.,"['like', 'cigarette', 'recommend', 'friend']",0.7898447,This cigarette should be more smooth for better experience.,"['cigarette', 'should', 'smooth', 'well', 'experience']",0.37705886
457,Marlts,K817,I like this product. It is similar to my regular brand. I will recommend it to my friends.,"['like', 'product', 'similar', 'regular', 'brand', 'recommend', 'friend']",0.859852,No changes required in the blend. Everything is okay.,"['no', 'change', 'require', 'blend', 'everything', 'okay']",0.9984413
458,MGA,G647,This cigarette is very hard and I will advice my friends not to use it.,"['cigarette', 'very', 'hard', 'advice', 'friend', 'not', 'use']",0.13402732,The blend should be little bit light.,"['blend', 'should', 'little', 'bit', 'light']",0.019907529
459,Marlts,B845,I like this cigarette to some extent. I will suggest my friends to try it.,"['like', 'cigarette', 'extent', 'suggest', 'friend', 'try']",0.96426755,I would like to reduced the quantity of tobacco and increase the flavor.,"['would', 'like', 'reduce', 'quantity', 'tobacco', 'increase', 'flavor']",0.0017013961
460,MGA,D782,I would like to share with my friends that it is a good cigarette.,"['would', 'like', 'share', 'friend', 'good', 'cigarette']",0.99286073,No changes required in the blend. It is good.,"['no', 'change', 'require', 'blend', 'good']",0.99936146
461,MGA,K817,It is a good product. It is light and the taste is also good.,"['good', 'product', 'light', 'taste', 'also', 'good']",0.94745755,No changes required in the blend. It is okay.,"['no', 'change', 'require', 'blend', 'okay']",0.9982912
462,Marlts,K817,The quantity of tobacco is very high and the taste is not that good.,"['quantity', 'tobacco', 'very', 'high', 'taste', 'not', 'good']",0.05684438,The quantity of tobacco should be reduced and the cigarette should be smooth.,"['quantity', 'tobacco', 'should', 'reduce', 'cigarette', 'should', 'smooth']",0.0010707047
463,Marlts,V476,I would like to share with my friends that it is a good product and they should try it.,"['would', 'like', 'share', 'friend', 'good', 'product', 'should', 'try']",0.96088374,No changes required in the blend. It is perfect.,"['no', 'change', 'require', 'blend', 'perfect']",0.9994474
464,MGA,B845,This brand is very light and it has no kick. I will still recommend it to my friends.,"['brand', 'very', 'light', 'no', 'kick', 'still', 'recommend', 'friend']",0.9617978,The quantity of tobacco should be increased so that the cigarette would be much better.,"['quantity', 'tobacco', 'should', 'increase', 'cigarette', 'would', 'much', 'well']",0.0045803343
465,MGA,T295,Blank,['blank'],0.78981745,No changes required in the blend. ,"['no', 'change', 'require', 'blend']",0.9974178
466,Marlts,K817,It is also a good brand. I will recommend it to my friends.,"['also', 'good', 'brand', 'recommend', 'friend']",0.99023134,No changes required in the blend. It is okay.,"['no', 'change', 'require', 'blend', 'okay']",0.9982912
467,MGA,V476,It is a good product. It has recently launched in the market.,"['good', 'product', 'recently', 'launch', 'market']",0.95046735,No changes required in the blend. It is good.,"['no', 'change', 'require', 'blend', 'good']",0.99936146
468,MGA,T295,It is very nice to smoke this cigarette. It is better than the previous one. It is smooth and it doesn't cause any problem while smoking.,"['very', 'nice', 'smoke', 'cigarette', 'well', 'previous', 'one', 'smooth', 'not', 'problem', 'smoking']",0.66079867,No changes required in the blend. It is good.,"['no', 'change', 'require', 'blend', 'good']",0.99936146
469,MGA,G647,This cigarette is medium. The quantity of tobacco is good.,"['cigarette', 'medium', 'quantity', 'tobacco', 'good']",0.586918,No changes required in the blend. ,"['no', 'change', 'require', 'blend']",0.9974178
470,MGA,V476,This cigarette is very strong. It caused irritation in the throat. I won't share anything about it.,"['cigarette', 'very', 'strong', 'cause', 'irritation', 'throat', 'not', 'share', 'anything']",0.052925456,I would like to reduced the quantity of tobacco.,"['would', 'like', 'reduce', 'quantity', 'tobacco']",0.005990206
471,MGA,B845,This cigarette is smooth and it didn't cause irritation in the throat.,"['cigarette', 'smooth', 'not', 'irritation', 'throat']",0.5111617,No changes required in the blend. The cigarette was perfect.,"['no', 'change', 'require', 'blend', 'cigarette', 'perfect']",0.99936146
472,MGA,G647,This cigarette was okay. It was very light and I didn't enjoy it much.,"['cigarette', 'okay', 'very', 'light', 'not', 'enjoy', 'much']",0.24669462,This cigarette is very light. It should be little bit hard for better experience.,"['cigarette', 'very', 'light', 'should', 'little', 'bit', 'hard', 'well', 'experience']",0.0027363512
473,Marlts,D782,It is a good cigarette. It is light and the flavor is also good.,"['good', 'cigarette', 'light', 'flavor', 'also', 'good']",0.96143526,No changes required in the blend. ,"['no', 'change', 'require', 'blend']",0.9974178
474,Marlts,K817,It was nice to smoke this cigarette. The quality of smoke was good and the taste was also good.,"['nice', 'smoke', 'cigarette', 'quality', 'smoke', 'good', 'taste', 'also', 'good']",0.9949005,No changes required in the blend. ,"['no', 'change', 'require', 'blend']",0.9974178
475,MGA,K817,This product is okay. It is light and the taste is also good.,"['product', 'okay', 'light', 'taste', 'also', 'good']",0.8636507,No changes required in the blend. ,"['no', 'change', 'require', 'blend']",0.9974178
476,MGA,B845,This cigarette is very strong. It caused irritation in the throat. I won't share anything about it.,"['cigarette', 'very', 'strong', 'cause', 'irritation', 'throat', 'not', 'share', 'anything']",0.052925456,I would like to reduce the quantity of tobacco.,"['would', 'like', 'reduce', 'quantity', 'tobacco']",0.005990206
477,MGA,V476,It is a good cigarette and I will recommend it to my friends.,"['good', 'cigarette', 'recommend', 'friend']",0.98084,I would like to add menthol flavor in this cigarette.,"['would', 'like', 'add', 'menthol', 'flavor', 'cigarette']",0.018796757
478,Marlts,D782,I would like to share with my friends that it is a good product.,"['would', 'like', 'share', 'friend', 'good', 'product']",0.99003536,No changes required in the blend. ,"['no', 'change', 'require', 'blend']",0.9974178
